{
  "card_id": "task:9004",
  "board_id": "project:42",
  "stage_id": "stage:30",
  "title": "Reconcile VAT input tax",
  "description_md": "Reconcile VAT input tax for December",
  "priority": "3",
  "due_date": "2025-12-18",
  "created_at": "2025-12-11T08:30:00+08:00",
  "updated_at": "2025-12-15T14:20:00+08:00",
  "owners": [
    {
      "partner_id": 1202,
      "email": "juan.cruz@company.com",
      "name": "Juan Cruz"
    }
  ],
  "watchers": [
    {
      "partner_id": 1201,
      "email": "maria.santos@company.com",
      "name": "Maria Santos"
    }
  ],
  "tags": ["tag:1", "tag:3"],
  "parent_id": null,
  "subtask_ids": ["task:9005", "task:9006"],
  "checklist": [
    {
      "id": "c1",
      "text": "Pull BIR reports",
      "done": true,
      "order": 1
    }
  ],
  "dependencies": [
    {
      "type": "blocks",
      "task_id": "task:8888"
    }
  ],
  "sequence": 1
}
